reviews,category
 기본 베이스      국어  한국사  행정법은 노베이스라고 봐도될거같아요  따로 공부를 한 적도 없어서 처음부터 차근차근 했어요   영어는 거의 토익공부만 했어서 토익    점 점수가있더라도 공무원 영어는 너무 다른느낌이었습니다  단어부터 범위가 다르고 토익처럼 스킬로 풀수있는것도 아니어서 영어성적 올리기가 제일 힘들었던거같아요  선택과목중  개는 과학을 선택했구요 과학은 공부를 좀 했어서 조금은 공부하기가 수월했습니다     하루 루틴    보통  시  시반까지 스터디카페나 도서관에 도착하려고 했구요 점심시간이랑 저녁시간은 최대한  시간 안쪽으로 맞추려고 노력했습니다     시반   시 까지 공부하다가 집에가서 씻고   시쯤 자려고 노력했습니다  막상 집에가면 공부가 잘 안되서 보통은 안했지만 핸드폰에 정리해둔거 틈틈이 본 적도 있어요  집공부는 너무 집중이 안되서 최대한 스터디 카페에 있는 시간에 공부하도록 노력했습니다    본인만의 필수과목    선택과목 학습법    국어는 기본인강 심화인강 등등 다 듣고나서는 모의고사 문제풀면서 틀린거 다시 암기하고  한자성어는 꾸준히 봤어요  그리고 비중은 낮지만 제일 어려웠던 고유어같은것도 신민숙 선생님 강의랑 프린트 보면서 계속 반복했습니다   한자 같은경우에는    정말 자주나오는 한자가 아니면 그냥 포기   했어요  다른데에서 한문제 더 맞추자 하는 심정으로 했습니다   비문학은 매일 풀기가 버거웠긴한데 최대한 하루이틀에 한번  문제씩 풀려고 했어요  절대 수능 비문학 풀지마세요   너무 넘사벽   어법은 모의고사 풀면서 까먹었거나 헷갈린거 다시 기본서 찾아보고 인강들었던거 정리한거 다시보면서 암기했습니다      영어는    제일 점수가 안오르고 점수 편차가 큰 과목이었습니다  시험을 볼때마다 점수가 들쑥 날쑥해서 제 실력이 어느정도인지 잘 모르겠더라구요  그래서 시험볼때 제일 무서웠습니다  일단은 영어단어      너무 광범위해서 어느부분에서 나올지도 모르고 동의어 찾는거도 힘들었어요   그래서 최대한 어휘는 매일매일     부터 누적복습하면서 외웠어요  흑흑 문법은 김철용 선생님 강의듣고 기본서 복습하고 회독만  번정도 한거같아요  하프모의고사 풀면서 틀린문제나 헷갈리는 문법은 다시 기본서 찾아서 복습했습니다  독해는 하프모의고사 매일 풀면서 시간도 재고 감도 익혔어요  독해문제는 처음부터 끝까지 읽지 않아도 답이 나오는 문제들이 있기때문에 그런문제는 실전처럼 답 찾으면 넘어가고 나중에 복습하면서 처음부터 끝까지 다시 읽고 독해하고 했습니다      한국사도 사실 외울게 너므 많았어요   저는 이과를 나왔고 한국사를 배운 기억이 너무 까마득하고 고등학교 다닐때도 좋아하지 않았어서 걱정이 많던 과목이었어요  이중석 선생님 강의 처음부터 차근차근 듣고 필기노트에 정리하면서 한번 더 외우고  정말    너무 안외워져서 계속 돌려봣어요 그러다보니까 어느페이지 어느면에 어떤내용이 있었는지가 외워지는 순간이 오더라구요  그래더 부족한건 기본서 한두번 더 돌려보면서 정리했고 하프모의고사나 기출문제도 많이봤어요      행정법은 정말  도 모르는 과목이어서 거의  년을 고생했습니다  용어도 모르니까 강의를 들으면서도 이해가 안가고 하다보니까 너무 스트레스였어요  그래도 꾸역꾸역 기본서 보고 강의듣고 복습하다보니까 문제도 풀리고 어느순간   점밑으로 점수가 내려가지 않는 마법같은 일을 겪었어요  이래서 행정법이 효자과목이다 라고 하나보구나 했어요  정말   하다보면 문제도 그문제가 그문제고 답도 보인답니다  꾸준히하세요    수강한 선생님 강의    국어 신민숙 선생님 들었구요 거의 모든 강의는 다 들었어요  기본강의  심화강의  모의고사  기출문제  특강 다      한 선생님께 배우니까 일관성있게 가르쳐주셔서 복습도 되는부분도있고 암기포인트도 반복되니까 저절로 머리에 들어오더라구요    영어는 김송희선생님이랑 김철용선생님 강의 들었구요  철용선생님은 특히 독해수업이 마음에 들었습니다  하나하나 정확하게 독해해주셔서 수업들으면서도 이해가 잘 됐고 하프모의고사도 꾸준히 들었습니다  매일 영어하프 하시는거 추천해요      한국사는 이중석 선생님강의 대부분 들었습니다  초반엔 특강부터 시작해서 기본강의  심화강의  근현대사 특강 등등 필기노트 위주로 강의를 진행하시고 복습도 필기노트에 필기한거 위주로 알려주시니까 자동으로 어느페이지에 뭐가있었지 하는거도 알게되는 순간이 오더라구요  기출문제 반복하시는거 추천합니다      슬럼프 극복방법    저는 슬럼프가 너무 많이왔어요    공부하기싫은날도 너무 많았고 하기싫어서 하루 쉬면 내일 더 하기싫고 악순환이 반복된다는걸 알았지만 사실 슬럼프를 극벅하는게 너무 힘들었어요  나 자신과의 싸움에서 매번 지는느낌   거기에 난 지금 이렇게 공부만 하고있는데 남들은 무슨일을 하고 어디 여행을 가고 이런걸 보는게 너므 스트레스고 자존감이 낮아지더라구요  그래서 저는    는 안했습니다  정신건강에 더 해로운거같았어요  슬럼프는 누구나 올 수 있고 그걸 극복하고 꾸준히 해내야 합격할수있는 시험인거같아요  하루 놀면 다음날 더 공부안되는 분들은 하루 통째로 쉬는 날을 만들지마세요  하루에 조금이라도 꼭 공부 하시고  쉬어야 다음날 더 공부가 잘 되시는 분이면 하루정도는 쉬어주세요  대신 쉬는날을 제외하고는 반드시 집중해서 열심히 하셔야 한다는 전제하에    안그러면 장수생으로 가는 지름길로 가시는겁니다  꼭 기억하세요    마지막으로 전하고싶은말    저는  년 반정도의 시간동안 지치고 힘들고 자존감도 낮아지고 자신감도 떨어지고 너무 힘들었습니다  이건 결국 다 제가 단기간에 집중해서 하지않은 저의 탓이었고 누굴 탓할수없었습니다  그래도 끝까지 버텨준 제 자신에게 너무 감사하네요  결국 고득점으로 합격 할 수 있었고  지방직 시험 본 당일날 채점하면서 알았습니다    와 이번엔 됐다  면접도 사실 너무 긴장되고 아무말이나 하고온거같아서 걱정을 조금 했지만 필기점수가 커트라인보다   점 높게나와서 될거라는 확신은 있었습니다  저는 국가직은 필기도 떨어졌는데 지방직은 필기시험도 아는부분에서 대부분 나와줬고 면접관분들도 편하게 리액션도 잘 해주시는 분들이셔서 면접관 운도 있었습니다  그동안의 노력으로 실력이 갖춰지고 운까지 더해져서 합격할수 있었던거같아요  직접 뵙지는 못했지만 가르쳐주신 선생님들 모두 너무 감사합니다  잘 버텨준 내 자신에게도 칭찬해주고싶네요   저는 여러분보다 머리가 좋지도않고 뛰어난 사람도 아닙니다  그러니 여러분도 충분히 해내실 수 있습니다  꼭 원하시는곳에 합격하시길 바랍니다 ,public official
지방직 최종합격수기입니다  수험기간                 기본베이스  한국사검정능력  급 공시 준비전 경험삼아 지방직 시험봤을때 영어 과락   국어 한국사   점대  생활 습관  스터디카페와 집에서 주로 공부했고 지겨울 땐 카페에서도 하면서 기분에 따라 공부 장소를 자주 바꿔줬습니다 순공시간을 늘리기 위해 새벽   시에 일어나려고 했지만 원래 습관이 있던지라 못 지키는 날이 많았고 그것때문에 스트레스를 받아서 오전에 일어나서 공부하되 시간을 구체적으로 정해놓지 않았습니다  마찬가지로 하루 공부 시간도 따로 정해놓진 않았고 대략    시간 정돈 하려고 했던 것 같습니다  준비기간이 길어지면서 체력적으로 힘든 부분이 있어서 일주일에 세너번정도라도 운동하려고 노력했습니다  공부방법     국어 신민숙   어법은 기본심화강의까지 다 들었고 기출문제를 풀면서 틀리는 부분을 따로 정리해서 자주 보려고 노력했습니다                        비문학은 따로 강의를 듣진 않았고 비문학 문제집을 사서 하루에    문제씩 풀면서 익숙해지도록 했습니다                        문학은 신민숙 선생님의 특강을 듣거나 문학 관련 문제집을 사서 자주 나왔던 문학작품정도는 알 수 있도록 했습니다                           영어 김송희   문법은 기본 심화강의까지 다 들었고 어휘는 해커스 노랭이 단어집을 외웠습니다  독해는 초중반까지는 기본서 독해책을  하루에    문제 정도 나눠서 매일 풀 수 있도록 하다가 다 푼 뒤에는 하프 모의고사를 매일 풀면서 감을 잃지 않으려고 노력했습니다   시험 당일 날에도 시험장에 가기전 하프모의고사를 풀면서 독해문제에 빨리 적응할 수 있도록 했습니다  영어 점수가 그렇게 좋은 편은 아니지만 그래도 처음봤을 땐 과락이었던 영어점수를 이정도라도 올릴 수 있었던 건 하프모의고사 덕이 큰 것 같습니다   하프모의고사 강추드립니다    한국사 이중석   한국사는 이중석 선생님의 올인원 강의를 들었습니다  이중석 선생님 강의를 들을 예정이라면 올인원 블랭크 노트를 구매하는게 좋을 것 같습니다  기본서만 가지고 강의를 들었을때 순서가 다르거나 추가로 필기해야될 내용들이 있어서 시간이 더 걸렸어요    처음부터 구매해서 들었다면 더 좋았을 것 같습니다     행정법  함수민    다른 과목도 그렇지만 특히 행정법과 행정학은 기출문제를 많이 보는게 중요하다고 생각합니다  강의만으로는 이해가 힘들고 기억에 오래남지도 않아서 무조건 빨리 기출을 시작하고 기출을 많이 풀어보는게 좋을 것 같습니다 시험보기    개월 전에는 행정법 기출을 풀지 못하는 날에는 하프 모의고사라도 풀면서 내용을 잊지 않으려고 노력했었는데 그게 큰 도움이 되었던 것 같습니다 시험 하루 전날 내용을 간략하게 정리해놓은 필기노트 함수민 필기노트 를 처음부터 끝까지 훑어보면서 전체적인 내용을 정리했습니다    행정학 송상호   행정학도 기출문제를 많이 보는게 가장가장 중요하다고 생각합니다  기본강의  심화강의 중반까지만 듣고 시간이 없어서 기출문제에 시간을 많이 투자했는데 이게 큰 도움이 되었던 것 같습니다 행정학도 행정법과 마찬가지로 기출문제를 풀지 못하는 날에는 하프모의고사를 풀면서 부족한 부분을 파악하고 보충하려고 노력했습니다  시험 당일날에는 동형모의고사책을 가지고 가서 틀린 문제 위주로 한번 훑어보면서 정리했습니다    면접  유튜브에서 피티윤 선생님 영상을 참고했습니다  면접 기출을 바탕으로 면접스터디를 통해서 발표연습을 충실히 한다면 원만하게 면접을 마칠 수 있을 것이라고 생각합니다  제 합격수기가 조금이나마 도움이 되었으면 좋겠습니다  모두 좋은 결과 있으시길 바랍니다 ,public official
  기본 베이스   지방대 공대  년    토익    점   수험 기간    개월                       공부 목표 및 방법 수험 생활을 시작하기 전 세웠던 공부방법은 공통과목  과목을  달안에  회독  그리고 나머지  개월 동안 선택과목 공부와 공통과목  회독 이상이라는 목표를 세우고 공부를 시작했습니다  한국사   가장 먼저 시작한 과목으로 가장 열심히 공부한 과목입니다  강의가 생각보다 많고 내용이 방대해서 시간을 가장 많이 투자했습니다  처음  개월 돟안은 복습보다는 진도를 빨리 나가야 겠다는 생각으로 공부해  개월 동안 이중석 선생님의 강의를 모두 수강하였습니다  강의를 모두 듣고 나니  권 반 정도의 노트를 만들 었는데 나머지  개월 동안은 이 노트를 참고하여 공부했습니다  국어   한국사와 비슷한 시기에 공부를 시작했습니다  비문학 독해 같은 유형의 문제는    공부를 하면서 어느정도 수준이 있다고 생각해 문법 위주로 공부를 많이 했던 것 같습니다  처음  개월은 신민숙 선생님의 문법 강의만 들으며 어느 정도 수준을 올리고  신민숙 선생님의 강의자료를 통해 나머지  개월 동안 복습하며 공부했습니다  영어   영어에 어느정도 자신이 있었기에 따로 강의는 수강하지 않았습니다  처음엔 헤커스 기본교재를 구입해 문법 부분을 빠르게  회독 하고 단어 암기 위주로 많이 공부했습니다  해커스에서 제공하는 기출 빈출 예상 단어를 하루에   개씩 외우고 복습했고  독해능력에 익숙해지도록 하루에  지문 이상씩 시간을 재면서 공부하였습니다   과학 수학   공대를 다니다 보니 수학 과학을 공부하는데에 시간이 많이 투자 되진 않았습니다  시험  달전부터 공부를 시작했고  처음  개월 동안 개념 공부  그 후  달 동안은 기출문제 위주로 공부했습니다     시험  달 전부터는 실제 시험이라 생각하고 기출문제와 동형 모의고사 위주로 공부했습니다  실제 시험장에 가서 문제를 어떻게 풀 것인지 막힌 문제가 있다면 어떻게 할 것인지 생각하고  실제 시험 시간인   시에 가장 잘 집중하기 위해 한달 전부터 생활패턴을 일정하게 유지했습니다     수강 선생님 추천 한국사   이중석 선생님               강의만 들었는데 이 강의만으로도 충분히 한국사를 공부하는데 어려움이 없다고 생각합니다  가장 좋았던 점은 수업이 재미있다는 것이었습니다  한국사의 범위가 워낙 넓다보니 지루할 수도 있다고 생각했는데 강의를 들으면서 지루하다는 생각이 들었던 적이 없고 정말 재미있게 공부한 과목이었습니다   국어   신민숙 선생님   국어 문법 기본과 심화를 모두 수강하였습니다  문법을 어려워했던 저에게 쉽고  반복적인 설명으로 문법에 대한 이해와 문제풀이를 쉽게 할수 있게 해주었던 강의입니다  특히 선생님께서 제공해주시는 강의자료는 시험 전날까지 챙겨가 볼 정도로 아주 도움이 많이 되었던 것 같습니다    슬럼프 극복 과정 지방직이 목표였지만 경험삼아 국가직 시험을 치렀습니다  가장 자신있었던 과목에서 만족스럽지 못한 점수를 얻으며 지방직 시험이 두 달 정도 남은 상황에서 조급한 마음이 들었습니다  이런 조급함에 공부에 집중하지 못한 적이 있는데 저는 이런 상황을 실제 시험장과 같은 상황을 만들어 생각해 보고 좋은 점수를 얻자라는 마음가짐을 가졌습니다     분안에  과목을 모두 풀어보고 마킹도 실제로 연습해보며 시험장의 모습을 항상 시뮬레이션 하면서 한달 넘게 연습했습니다  이런 행동을 반복적으로 하다보니 자연스럽게 점수가 올랐고  실제 시험장에서도 긴장하지 않고 시간안에 모든 문제를 풀 수 있었습니다     마지막으로 하고 싶은 말 수험생활을 하면서 후회없이 공부했나라는 생각을 했을 때 저는 자신있게 후회없이 공부했다고 말할 수 있습니다  이 글을 읽고 계시는 수험 생활을 이제 막 시작하시는 분들 모두 후회없는 수험생활 보내셨으면 좋겠고  끝까지 포기하지 않는 마음가짐으로 모두 좋은 결과 있으셨으면 좋겠습니다  감사합니다 ,public official
