reviews,category
안녕하세요 이번     년   회 공인중개사 시험에 동차 합격한   살의 남자입니다  시험을 치고 한 달동안 제가 마킹은 잘 했는지 걱정했는데 원하던 결과를 얻어 한 결 편해진 마음으로 이 수기를 작성합니다   제가 이 공부를 하게 된 계기는 먹고 살기 위해서입니다  시험은 올 해   회로 합격을 했지만 최초 강의는 작년     년에 결제를 했습니다   그 때 당시엔 하는 일이 있어서 어떤 시험인지 맛만 볼까  라는 아주 안일한 느낌으로 시작했지만 이 일로 먹고 살아보겠다는 열의가 없다보니   월   월 분인 입문서조차 절반도 못 본 상태에서 치뤘습니다   말 그대로 강의구독기간 연장용 시험응시였죠  그러다 종식될 기미가 보이지 않는 코로나로 인해 기존에 하던 자영업이 가능성이 보이지 않아 일을 그만두고 올 해  월부터 공인중개사 시험에 매달렸습니다   저는 해커스로 공부를 했습니다  에듀윌  박문각  메가랜드 등등 많지만 왜 해커스를 선택했냐면  토익공부 하던 시절에 해커스를 이용했어서 인강은 해커스지라는 생각에 다른 업체와 큰 비교 없이 골랐는데 후회하지 않습니다  어떤 브랜드의 강의든 결국은 그 것을 듣고 내가 얼마나 공부하느냐이기에 브랜드 차이는 없다고 생각합니다  하지만 저는 해커스를 듣고 합격했으니 해커스 추천에 숟가락 하나 살짝만 얹어 볼께요     각 과목 별 교수님은 아래와 같습니다     학개론   신관식 교수님   길게 말 하지 않습니다  학개론  신교수님 고르시면 됩니다   집중 해야할 부분  과감하게 버릴 부분 전부 골라주십니다  그 것만 공부하시면 됩니다  그리고 강의를 듣는 내내 졸리지가 않습니다  이게 엄청 중요합니다   그리고 쉽습니다  정말 쉽게 설명해주십니다       민법   채희대 교수님   위와 같습니다   민법   채희대  대명제입니다  그냥 받아들이시면 됩니다      중개사법   황정선 교수님   버릴 부분  취해야 할 부분 명확하게 집어주십니다  쓸 데 없는데 투자 할 시간을 가시적으로 줄여줍니다      공법   한종민 교수님   쉽게 설명해주십니다  다들 공법이 공인중개사  개 과목중에서 가장 어려운 과목으로 인지하고 계실겁니다   그런데 한종민 교수님은 그 순서를 바꿔주십니다  어려워서 손이 안가는 과목이 아닌 수업을 듣고 책을 보면 이해가 가서 더 책을 보고싶게 만들어 주십니다  아 그런데 교수님이 워딩이 좀 쎄세요  그래서 그런거 민감하신 분들은 다른 분을 고르시는게 낫습니다   저는 그 말을 듣고 오히려 자극 받아서 좀 더 열심히 했습니다      공시법   홍승한 교수님   원픽  안돼  안바꿔줘  홍교수님이 최고야  저한테는 해커스 모든 과목 교수님 중에서 최고입니다  재밌습니다  쉽습니다  안졸립니다  명확합니다  시간 줄여줍니다  짱짱맨입니다      세법   강성규 교수님   솔직히 말하면 세법이 저는 제일 어려웠습니다  그리고 시험 전 날 까지 가장 손이 안가는 과목이었구요   어떤 교수님 수업을 들어도 재미가 없고 책에  강의에 손이 안갔습니다   처음에 강성규 교수님 강의를 듣다가 너무 손이 안가서 이교수님 저교수님 돌고 돌다가 결국 다시 강성규 교수님 수업을 들었구요   정 붙이기가 가장 어려운 과목이었습니다  그리고 가장 많이 틀렸구요  세법은 제가 뭐라 할 말이 없습니다  죄송합니다     전체적인 공부 방법은 아래와 같이 했습니다    년 기준으로 나오는 커리큘럼을 따라가기에는  월이라는 늦은 시간에 시작했기때문에 인강 듣는 기간을 잘 조절해야했습니다  일반적으로  년 기준으로      월 입문     월 기본     월 개념완성     월 핵심     월 문풀   월 동형    월    선 이런식입니다  저는  월 입문   월 기본     월 개념완성     월 핵심 이렇게 들었습니다  최대한 빨리 많이 들어야 했기에 이런 식으로 들을 수 밖에 없었습니다  그러면 입문  기본을 넘기고 개념부터 들으면 되지않겠냐 하시는 분들도 있을텐데  앞에 비교적 가볍게 설명해주는 입문과 기본을 듣지 않으면 헤매다가 시간을 낭비한다기에 빠르게 입문과 기본과정을 들었습니다   하루에 많은 양의 강의를 들어야 했기때문에 속도를 빠르게 들었습니다  정말 어렵고 생소한 부분은    배속  대충 무슨 말인지는 알겠다하면      배속  쓸 데 없어보이는데 싶으면    배속 까지 들었습니다  저는 강의를    배속인 정속으로 듣는 것은 정말 비추천합니다   강의를 듣는 것은 공부가 아니라고 생각하기 때문입니다  강의를 들으면서 이 내용이 아 이런 내용이구나 하면서 단어와 문장에 익숙해지기 위해서 듣는 것이라고 생각했습니다   핵심강의까지 듣고 이 후 강의는 듣지 않았습니다  이건 지극히 개인적인 차원입니다  문제풀이  동형모의고사     선 강의 듣지 않았고 모의고사 풀지도 않았습니다   월 초 핵심강의를 다 들은 후 부터는 핵심요약집과 기출문제집 이 두 개만 봤습니다  다른 건 쳐다보지도 않았습니다  흔히들 얘기하죠 기본서를 통달해야한다  모의고사 매 주 쳐봐야한다     선 봐야한다 이것 저것 다 봐야한다  저는 선택과 집중을 했던 거지 저거 다 보면 나쁘다가 아닙니다    다시 말하지만 지극히 개인적입니다     횟수는 시험날까지 요약집이랑 기출문제집은    번은 본 것 같습니다  세법은 손이 잘 안가서  번정도  세법은 다른데서 점수 메꾸자 라는 생각이 컸습니다   세부적인 공부방법은 별 거 없습니다  핵심요약집은 교수님들이 보라고 한 부분  형광펜  밑줄  동그라미 친 부분만 계속 봤습니다  아무 표시가 없다  쳐다도 안봤습니다   물론 불안하실겁니다  여기서 나오면 어떡하지  이거 안봐도 되나    저도 그래서 몇 번 봤는데 보다보면 압니다  기출문제에 안나와요   그럼 나올 일이    는 없다고 봐도 됩니다  나온다  그건 틀리라고 낸 부분이니까 그냥 틀리시고 다른 중요한 부분 보고 문제 맞추는게 더 낫습니다  기출문제집은 처음은 연필로 풉니다  한 파트 단위로 보세요  보통 적으면    문제  보통      문제  많은 파트는      문제 정도 되는데 쭉 한 번에 풀었습니다  그리고 풀이를 봅니다  이 때 내가 정답 맞춘건 하나도 안중요합니다  오히려 틀린게 낫습니다  맞은건 기억에 안남습니다  틀려야 내 머리에 남거든요  맞춘 문제든  틀린 문제든 무조건 해설 봅니다  왜 틀렸는지 봅니다  이해가 되든 안되는 모든 지문의 풀이를 봤습니다   이렇게 하루가 가면 푼 문제의 정답을 지우개로 빡빡 지워서 체크한 흔적을 남기지 않습니다   회차까지는 이렇게 풀었습니다  이러다보면 암기해야하는 내용의 지문들은 스윽 머리속에 남습니다  왜  중복되는 내용의 지문들이 많기때문에 눈에 익습니다  자연스럽게 머리에 남죠  이해를 필요로 하지 않는 내용이니까요   회차 풀때부터 이해안되는 지문은 별표시를 하고 중요한 지문은 형광펜으로 체크하면서 봤습니다  이 때부터 이해 안되는 부분은 파트풀이 끝내면 요약집보고 해당 부분 공부하고  책 봐도 이해 안되면 그 부분만 강의 찾아서 짧게 듣고 했습니다  이렇게    번은 본 것 같습니다  하루를 기출 풀고 요약집 보고 했던거 같습니다   공부하면서 느꼈던 주의사항만 전해드리고 마무리 하겠습니다     인강은 인강일 뿐입니다     인강 듣는 순간은 공부하는 시간이 아닙니다  인강   개 듣고 책 펴서 보면 무슨 내용인지 하나도 모릅니다   인강을 듣고난 후 혼자 책을 보면서 아 이게 이 말이었구나 하면서 공부할 때가 진짜 공부하는거지 인강 듣는 순간은 그 내용에 익숙해지기 위한  버릴 내용을 걸러내는 시간일뿐입니다      계산문제에 너무 메달리지 마세요    지극히 개인적인 파트입니다  저는 문제 풀때도 그 날의 계산문제는 한 번에 몰아서 풀었습니다  그리고 진짜 어렵다  풀이를 봐도 왜 이따위로 푸는지 이해가 안간다 하는건 그냥 버렸습니다  그 시간에 짧은 지문의 다른 문제 두개 더 맞추는게 이득입니다      방해물을 멀리해라    공부할 때 컴퓨터  핸드폰 최대한 멀리하세요  정말 자기 절제력이 강한 사람이 아닌 이상 문명의 이기에 휘둘립니다  난 아닐거야  당신도 휘둘립니다  잠깐 쉬면서 유튜브 하나만 볼까  인스타나 좀 봐볼까  한시간 지납니다      장소를 잘 선택해라    공부하는 장소를 잘 고르세요  나는 집에서가 제일 잘 된다 하시는 분은 집에서 하시고  난 집에 있으면 나도 모르게 침대에 누워버려 하시는 분들은 카페를 가시거나 스터디카페  도서관을 가세요  도서관은 졸리고 카페는 돈이 아까워 하시는 분은 떨어지고 내년에 또 하실 시간은 안아까우신가요       경쟁자를 만들어라    저는 공부할 때 문제풀고 요약집 볼 때 모니터에 공부브이로그 매일 실시간으로 하시는 분들거를 틀어놓고 했습니다  그래서 저사람이 쉴때 나도 쉬고 공부할땐 나도 공부한다 하는 생각으로요       똑같이 하긴 힘들지만 도움 됐습니다      선택과 집중   많은 교재를 보지마세요  최대한 줄여서 한 권만 완벽히 보는것도 어렵습니다      쉴 땐 쉬어라    인간인지라 매일 똑같은 스케쥴로 살기는 어렵죠 분명  저도 그랬구요  정말 책 보기 어렵다  강의 들어도 집중이 안된다 할 땐 저는 과감하게 공부 안했습니다 그날  혼자 누워서 쉬던  나가던 그 날은 책 아얘 안폈습니다  심할 땐 일주일정도 안 본 적도 있구요  집중안되는데 답답하고 토할거같은데 억지로 앉아서 책 봐도 내용이 머리 속에 하나도 안남더라구요  그래서 그럴 땐 그냥 쉬었습니다   쉬고나면 오히려 더 집중합니다  남들보다 좀 더 쉬었으니깐 진도 맞춰갈려면 더 열심히 해야한다는 마음으로요     카페에 들어오지 마세요    시험정보를 얻을 수 있는  같은 공부하는 사람들의 하루  고민을 들을 수 있는 카페들이 많습니다  공도사 공사모 등등 들어오지마세요  들어와서 얻을 수 있는 시험 정보  강의 교수님들이 실시간으로 다 말해주십니다  같은 공부하는 사람들의 고민  힘듦  들어서 뭐 본인한테 도움되는거 하나도 없습니다  그거 보면서 핸드폰  마우스 잡고 있을 시간에 차라리 잠을 자세요    이상으로 수기를 마치며 이 글을 보시는 분들한테 단   이라도 도움이 됐으면싶습니다    회 시험 응시하시는 모두 좋은 결과 얻어가시길 바라겠습니다  감사합니다 ,real estate agent
먼저 단기간 내에 합격할 수 있도록 도와주신 교수님들께 감사인사를 먼저 전해드립니다  제가 선택했던 교수님은 민법 이종근 교수님  학개론 신관식 교수님  공법 한종민 교수님  세법 강성규 교수님  중개사법 황정선 교수님  공시법 홍승한 교수님 이었습니다   월   일에 가입신청하고  교재를  월   일에 수령하여 공부를 시작하였으니 합격하기 까지 약    개월 정도 걸렸네요  처음 시작할 때만 해도 충분하다고 생각했으나 아버지의 병환 소식과 병원 임상시험으로 인해 평일 주간에는 매일같이 아버지를 모시고 병원에서 살다시피해야하는 문제로 인해 절대적인 시간이 부족한 기간이었던 것 같습니다  그렇다고 공부를 핑계로 아버지를 다른 이에게 맡길 수도 없었고  다른 방도도 없이  필승의 각오로 필사의 전력을 다한다 는 각오 하나만 가지고 코로나 집합제한 오후   시 으로 인해 시간이 부족하다 느껴지면 틈새 시간을 내어 암기 사항에 대해 한번 훓어보는 시간으로 활용하고  병원 다녀오면 독서실  주말은 무조건 독서실에서 살다시피 하였습니다  그러나   월까지만 해도 모의고사 결과는 참담하리만치 과락을 겨우 넘기는 수준이었고  저희 부모님은 아버지 병원 수발로 인해 행여 불합격하지는 않을까 매일같이 걱정하며 미안해하시는 모습에  필승이 아니면 불효하는 것 이라고 생각하여 흐트러질 수 있는 제 마음을 다시 가다듬고 정진할 수 있었습니다  결국 점수는 점차 오르는 모습을 보였고  초반에 꼼꼼하게 정리하였던 저만의 정리노트와 교수님들의    선  특강 등을 최대한 활용하며 계속 반복하고 암기한 결과 모든과목   점을 넘어 합격할 수 있었습니다  이 모든 과정이 제가 혼자 오만 각오를 다진다고 합격할 수는 없었으리라 확신합니다  해커스의 체계적인 커리큘럼과 단계적인 교육으로 인해  반복 과  반복 으로 열댓권에 이르는 엄청난 분량의 교재에 구석구석 형형색색 형광색이 입혀지고  낙서가 되어짐으로써 합격할 수 있는 근간이 되었습니다  다시 한번 위 교수님과 해커스에 합격할 수 있게 도와주셔서 진심어린 감사의 마음을 전합니다  감사합니다 ,real estate agent
안녕하세요 인강수강생입니다 저는 처음에 여러군데 무료강의를 듣다가  월중순부터 해커스를 선택해 들었습니다 한분한분 교수님들의 열정이 정말 대단하셨어요 매강의마다 쉽게 더 알려주시고자 애써 주시고 도움되는 팁들과 공부밥법까지 제시해 주셨어 그 열정 덕분에 동차합격까지 가능했다고 봅니다 짧은 기간동안 준비해서  과목 골고루 합격점수가 나올 수 있었던 것은 교수님들의 정성들인 교재자료와 강의 지도 덕분이었습니다 지치고 느슨해지려고 할때마다 강의 중간중간 격려와 조언들이 마음을 다잡게 해주었습니다  월초엔 동형점수를 보고 걱정했지만 지금부터라도 동형과 총정리만 잘해도 합격가능하다는 교수님 말씀에 정말 동형 제가 틀린 문제들을 보니 맞출수 있는 문제들이 보였고 그때부터 어려운 문제보다 맞출 수 있는 문제들은 놓치지 않도록 동형후 그런 문제들을 꼼꼼히 정리했습니다   월 민법등 불안한 과목들은 총정리 특강을 반복해 들었던 것이 많은 도움이 되었습니다 또한 마지막 힘까지 다 하라는 교수님 말씀에 정말 막판엔 모든 시간을 올인했던 것 같습니다 시험치고 가채점 당시 합격점수보다 조금의 여유점수를 받았으나 혹시나 마킹이 잘못 됬으면 어쩌나 하는 불안감이 있었는데 합격발표날 결과를 보고 정말 기뻣고 해커스와 함께해서 다행이었다고 생각합니다  해커스와 교수님들 정말 감사드립니다,real estate agent
작년  월 이제 애들도 많이 컸고 일좀 시작해보자 해서  취직한곳이 동네 부동산 이었다  자격증은 없었지만 옆에사는 도련님네가 부동산 하는걸  좀 봐서 그런지 자연스럽게 들어갔다  막상 들어가보니 음   이 업계에서 일을 하려면 자격증은 있고봐야겠다고 팍팍 느끼고 공부시작  우선 올해  차를 붙고 내년에  차 붙자 하며  민법 채희대   중개사법 신관식   월 강의부터 들었음 앉아서 공부할 시간은 부족하니 오고가며 동영상강의 반복반복 그렇게 나름 최선을 다해  차 합격   올해  차는 떨어지면 절대 안되니 더 열씸히하자 시간도  년이나 있잖아 맘 먹었으나    개월 공부해서  차 붙었는데 뭐 하는 생각이 마음깊이 있는지 막상  월부터 하려던 공부가 잘 안되는거임    그래서 시험 막판됐을땐 아직도 할게 너무 많은거임    완벽할순 없으니 문제풀이에 집중하고  반복반복  결과는 평균   점    겨우 턱걸이 합격했다  해커스에 너무 감사합니다  질 높은 강의와 커리큘럼 진짜 짱 짱 짱 ,real estate agent
안녕하세요   평범한   대 직장인이자 초딩 둘을 두고 있는 가장입니다   시간이 날때면 핸드폰만 만지작거리고 숨만쉬며 나이만 먹어가는구나 라고 생각하며 정말 나이만 먹어가는 하루하루를 보내고 있었습니다   그러던 중 작년  월 핸드폰 뉴스사이로 보이는  부동산공인중개사 합격률  위   해커스 공인중개사   라는 광고가 눈에 들어왔습니다   그래 이거다   학창시절 내가 공부를 안해서 그렇지 하면 엄청 잘했을거야   지금이라도 늦지 않았다 한번 해보자   라고 마음을 먹고  바로 전화번호를 눌렀습니다   지금부터 등록하셔서  차과목 인강 들으시다가   월부터   회 인강을 시작하니   월부터는 커리큘럼에 맞게 인강을 따라가시면 됩니다  라며 차근차근 설명해주시더라구요   그래 해보자 이왕 할거면 남자가      환급정도는 받아야지라는 마음으로      환급반 등록     등록하고 바로 처음으로 들은 동영상강의는 그 어렵다던 민법  처음이니 너무 생소하고 어려웠지만 채희대 교수님의 설명을 들으면 조금씩 알아갈 수 있었습니다  그다음으론 학개론  신관식 교수님의 목소리에 귀을 기울이며   월까지 민법 학개론 기본이론  회독을 끝마쳤습니다    월 입문이론을 시작으로 본격적으로 공부를 하게되었고 그 후론 하루하루 정해진 시간에 학생들이 학교에 가서 수업시간이 되면 어찌되었건 수업을 듣듯이 무조건 시간을 내어서 인강을 들었습니다  그렇게 하루하루 인강을 들으며 공부하다 보니 어느덧 입문이론  기본이론  개념완성  핵심이론 과정  문제풀이 과정이 끝이 나고  월   그동안 월요일은 공법  화요일은 중개사법  수요일은 공시법  세법  목요일은 민법  금요일은 학개론 이렇게 일주일을 공부하고 주말에 쉬었다가 다시 월요일 공법책을 꺼내서 지난주 배웠던 내용을 보면 정말 한 개도 기억이 나질 않았고  내 머릿속엔 자잘한 단편의 기억만 있을뿐 뭔가 알 것 같지만 제대로 알지는 못하고 뭔가 잡힐 듯 하지만 멀기만 한 느낌이어서 내가 공부를 잘하고 있는것이지  이렇게 해서 시험을 합격할 수 있는 것인지 확신은 전혀 없었고  떨어지면 어쩌지 라는 막연한 공포심마져 생겼습니다  그런데 그때 세법 강성규 교수님의 말  원래 다들 이 시기엔 그렇다  동형모의고사와    선을 하다보면 머릿속에 정확하게 정리 될 것이다   월    월이 시험의 당낙을 결정한다  이말을 듣고 다시 열심히 해보자 다짐하며  월   월 해커스의 커리큘럼대로 열심히 하였습니다  역시 최강의 커리큘럼   신기하게도 진짜 희뿌옇던 머릿속이 말끔이 정리가 되며 단편적인 기억의 조각들이 맞춰져가고 있었습니다  시험장가기 전 모의고사에서는 평균   점 정도가 나오더군요  그렇게 자신감을 가지고 시험장으로 향하였고 동차 합격을 하게 되었습니다    학개론   신관식 교수님 민법   채희대 교수님 중개사법   황정선 교수님 공 법   한종민 교수님 공시법   김의열 교수님 세 법   강성규 교수님   위의 교수님들께 정말 감사드리고 교수님들의 강의는 정말 판타스틱합니다   그리고 해커스의 커리큘럼대로만 열심히 하신다면 합격은 언제나 함께할 것입니다    공인중개사 자격증 취득을 원하시는분들게 해커스를 꼭 추천하고 싶습니다  ,real estate agent
지인 권유로 멋모르고 시작했다가 드디어 합격했어요 처음에는   점 이상이면 합격이라고 해서 좀 만만하게 봤는데 첫 책장을 펼치고 캄캄했어요  여러 과목들은 이름 마저 생소하고 낯설었어요 불합격 후에 자괴감이 들었지만  실생활에 필요한 상식과 지식이 가득해서  살면서 사기는 안 당하고 살겠구나 하는 생각이 들어 나름 만족했어요  어쨌든 직장을 다니고 있기에 올해만 보고 접으려고 했어요 은근 패배감과 스트레스가 쌓이더라구요 평생 무료 수강으로 등록 안 했으면 진즉에 그만 뒀을 거예요  주로 새벽 시간과 주말에 열공 했고  직장인이라 시간이 부족 해서  과목 전부   점 대를 목표로 골고루 공부 했어요  교수님들이 강조하는 핵심 위주로 암기하고 기출문제집과 모의고사 위주로 문제를 풀었어요 역시 가르치는 선생님은 중요해요 공법과 공시법은 암담 했는데 한종민  홍승한 교수님 덕분에  차도 통과 했어요 신관식  채희대 교수님 덕분에   차는 당연히 붙을 것 같은 예감이 들었어요  한숨과 고민도 많았던 올해 공인중개사 합격으로 유종의 미를 거두게 돼서 기쁩니다      ,real estate agent
