reviews,category
우선 합격글을 쓸 수 있게 되어 무척 기쁘고 해커스공인중개사 스탭 및 강사님 들께 감사드립니다      공부 기간      회차  동차준비 작년  월    회차 시험에서  차 평균   점   차   점 탈락 하였습니다       회차  어느정도 흐름은 알고 있다고 생각해서  월부터 시험 전  개월 부터는 아침  저녁 시 순공  시간 정도 했습니다      공부 방법    인강을 이용해서 공부 하였고 특히  월부터는 해커스에서 주최하는 실전모의고사를 치루면서 실전감각을 많이 키웠습니다     모든 교수님들 말씀처럼 기출 문제를 병행 하시길 추천 드립니다        수강 했던 교수님    학개론  신관식 교수    민법  채희대 교수  중개사법 황정선 교수    공법   한종민 교수    공시법  양기백 교수   세법   강성규 교수     공부 관련 팁    개인적으로   대이다 보니 부동산 관련 접해볼 기회가 없어서 관련 지식이나 교양이 전혀 없었습니다  모든 용어가 생소해서    용어에 친해지는 것이 최우선이라고 생각합니다     초반에는 강의를  들어도 무슨 말인지 혹은 어떤 맥락인지 파악하기가 무척 어려웠습니다     하지만 교수님들 말씀 처럼 회독에 회독을 거듭하다보면 어느순간 귀에 들리는 것이 늘어실텐데 이때 문제를 같이 풀면서    실력이 많이 늘었던 것 같습니다      처음에 이해가 안된다  단어를 모르겠다 들어도 모르겠다 생각해서 절대포기 하지마시고 회독 회독 회독하시면 반드시 귀가 열리실 겁니다    누군가는    개월 만에 따는 자격증이라 말할 수 있겠지만 저는 나름 최선을 다해서 딴 자격증 이었던 것 같습니다     쉽게 접할 수 있는 자격증은 맞지만 쉬운 자격증은 결코 아닙니다 시작하시는 분들 및 베이스가 전혀 없으신 분들    절대 포기하지 마시고  반드시 합격 하시길 바랍니다  ,real estate agent
안녕하세요    회 공인중개사 동차합격한  초등아이 둘을 둔   대 아줌마 합격생입니다     올해초   년을 일했던 직장생활에 회의가 느껴져 일을 그만두고  흐지부지 가는 시간을 놓치기 싫어 선택한 공인중개사 공부가 좋은 결실을 맺게 되어 너무 기쁘네요  내년 시험을 준비하시는 분들께 조금이나마 보탬이 되었으면 하는 마음에 후기를 씁니다       회 공인중개사 시험결과  부동산학개론   점 민법     점 중개사법   점 공법   점 공시 세법   점       해커스 를 선택하다  처음에 해커스를 선택한 이유는  홈페이지의 산뜻한 디자인   교재비 포함한 전금액의 환급조건 때문이었습니다  그리고 결제 직전  대학졸업후 근   년만에 해보는 공부인데 조금만 더 제자신을 채찍질 해보자는 뜻에서 올해동차합격   민법   점 이상 달성시     를 환급해주는 환급코스를 선택하게 되었어요          월    차 과목만 먼저 기본강의부터 완료    차 심화강의 단원별 기출문제풀이 병행    차 기본강의 시작  월에 결제를 했지만  설연휴 등등으로  월은 흘려보내고   월부터 인강을 본격적으로 보기 시작했습니다  처음에는    차 전과목을 일주일에 하루씩 할당하여  강 정도를 보는 것으로 목표를 세웠으나  한달 정도 진행해보니 일주일에 한과목씩 돌아가며 듣는게 공부 머리가 현저히 떨어져 있는 저에게는 비효율적이더라구요   주일에 하루씩 과목이 배정되니  인강 듣고 일주일 있다가 책을 펴면 기억상실증 마냥 일주일 전 들었던 내용이 정말 하나도 기억이 안나는 경험을 몇 번이나 하고는 안되겠다 싶어   차  과목만 집중하는 것으로 계획을 수정했어요   주일에 개론  일  민법  일정도로 기본강의를 쭉 들었고   월화수 개론 목금토 민법  지겨우면 일주일내 오전 개론  오후 민법 으로 가꿔가며 들음   기본강의를 끝내고 심화강의 들어가면서 일주일에    일은  차과목 심화강의 단원별 기출문제풀이     일은  차과목 기본강의를 듣기 시작했어요          월  차  요약집 핵심이론 강의  차  기본 심화 요약집 핵심이론 강의 제가 문과 성향이라  차과목 둘다 저랑 잘맞기도 했고  두어달을  차에 매진하니  월초즈음  차과목 모의고사 점수가   점 전후 점수대가 나오더라구요  그래서  차과목 심화강의가 끝나고는  차는  주일에  일 정도만 배정 요약집 강의만 듣고  나머지는  차과목 강의에 집중했어요           월 노트정리 기출문제 반복풀이 모의고사풀이 과목별로 기본 심화 요약집강의까지  회독을 한셈인데도   월말에 모의고사를 보니  차과목은 문제가 너무 풀리지 않더라구요  또한 최소한의 시간을 배정해서 공부했던  차과목도  월보다 점수가 더 내려가는걸 느끼고  이때부터 복습과 강의를 내것으로 만드는 시간이 필요하다싶어  월부터는 요약집을 읽고 노트필기를 했어요  노트정리는 공부하는 성향에 따라 선택적인 부분인데  저같은 경우는   대때에도 시험공부를 별도 암기없이 노트정리만 한번 하면서 정리하던 습관이 있었어서 저한테 맞는 공부방법인 것 같더라구요  과목별로 전체 내용을 간단히 정리하는데 과목별로    일은 꼬박 걸려서 이렇게 해도 될까 불안하긴 했지만  확실히 한번 정리하고 나니 이해도가 높아지더라구요  또한 틈틈이 시간날 때 보면 암기도 잘 되는걸 느끼고는  공법은  번 정리를 했네요      월에는 일주일의 반은 노트정리  반은 기출문제 모의고사 풀이 틀린부분 복습 으로 했던 것 같아요      총평    월   일 약 평균  시간 공부     월   일 약 평균  시간 공부   아무래도 직장을 그만두고 아이들 식사만 챙기고  나머지 시간은 공부에 활용하면 되는 상황이어서 공부할 여건이 되었고  육아후 온전한 나자신의 삶과  공부에 갈증이 있던 상황이라 끝까지 포기하지 않고 꾸준히 공부에 매진할수 있었던 것 같아요  무엇보다도 해커스 기본 심화 핵심 강의를 몇 달동안 쭉 연결해서 들으면서 조금씩 조금씩 천천히 채워져  이후 이를 바탕으로 혼자 정리하며 공부하면서 단기간에 점수가 많이 올랐어요  처음부터 욕심내서 책을 파고들기보단  시간이 있으시다면 우선 초반 몇달은 강의를 쭉 들어보실 것을 저는 추천드립니다      부동산학개론   강양구 교수님 카리스마 있으신 모습에 선택했는데 시험에 필요한 부분만 짚어서 수업을 잘해주셨고  수업중에 강조하신 부분들 위주로 집중공부했어요  과목 자체도 문과 성향인 저랑 잘 맞아 제일 수월하게 공부한 과목입니다  어려운 경제용어 나오는 파트와  시간이 많이 소요되는 중고급 계산 문제는 처음부터 포기하고 뛰어넘었지만 나머지 파트는 꼼꼼히 공부했고  운좋게도 포기한 부분에서 시험문제가 거의 나오지 않았어요    몇가지 수월하게 풀 수 있는 계산 문제는 놓치지 않으려고 마지막 일주일은 매일 같은 문제유형을    문제씩 풀었습니다    민법   채희대 교수님 법관련 공부는 처음이었고  민법의 악명을 익히 들어 조심스럽게 강의를 듣기 시작했는데  예상외로 첫강의부터 재미있게 수업을 들었어요  판례를 정말 이해하기 쉽게 설명을 잘해주셔서 기억이 잘 나더라구요  물론 처음에는 강의 들어도 이해가 잘 가지 않는 파트들도 있었지만  강의  회독을 들으니 웬만큼 이해가 갔고  정말 이해하기 어려웠던 부분은    문제 분량 정도 될 것 같아 그냥 패스하였어요   시간을 더 들이면 이해할수 있을 것 같았고  사실 더 파고들어 공부하고도 싶었지만 꾹참고 시간대비 효율을 선택하였습니다  민법에서의 자신감은 공시법  중개사법 공부할때도 큰힘이 되니 민법에 투자를 많이 해놓으시면  차준비에도 꽤 플러스 요인이 될 것 같아요    중개사법   황정선 교수님 젠틀하고 깔끔한 수업방식이 인상적인 교수님이세요  중간중간 해주시는 실무부분 이야기도 재미있었어요  중개사법 같은 경우는 다들 점수받기 쉬운 과목이라고 했지만  암기를 싫어하는 저는 쉽지가 않았는데  전체 요약집 보며 노트 정리하는 단계를 거치며 머릿속에 자동배열되는걸 느꼈고  암기부분만  차로 조금만 시간 투자를 해줬더니      월 꾸준히 모의고사 점수가 잘 나오게됐어요    공법   한종민 교수님 깔끔하고 위트있게 수업하셔서 수업듣기 편했어요  그럼에도 불구하고 공법 과목 자체는 너무나 생소하고 몇 번 들어도 처음 듣는 내용같은 정말 마의 과목이었어요  핵심요약집 강의하실때는 강의들으면서 보여주시는 내용을 다 필기했고  강의끝나고 나서 따로 요약집 노트정리도 꼼꼼히  번 반복했어요  정말 내용이 방대하고  휘발성이 강해서 어려움을 많이 겪었지만  그래도   월즘 되니 모의고사   점 밑으로는 나오지 않아  과락 면하는게 어디야  라며 최면을 걸며 끝까지 페이스를 유지할 수 있었어요    공시법   홍승한 교수님 사실 공시법은 제스타일에 맞는 교수님이 안계셔서 방황을 좀 하다가  따뜻한 인간적인 모습으로 수업하시는 교수님을 선택했어요    공시법도 다들 점수받기 좋다는 지적법이 저는 너무 어려워서 고전하다  중개사법과같이 노트 정리 집중 암기를 조금 해줬더니 점수가 빨리 올라왔습니다    세법   강성규 교수님 인강만 들어도 공부가 되는구나 새삼 느겼던 과목입니다  세법이 쉽지는 않지만 수업이 재밌어서 인강 들을때는 집중을 해서 들었더니 기본 뼈대가 머릿속에 들어와 있었고  기본 심화 요약 강의후 따로 공부없이 쳤던 모의고사에서 거의 절반을 맞추었더라구요   교수님 목소리가 귓전에 들리는듯하는 경험도 했어요    그래도 시간적인 여유가 있어서  일 풀로 요약집으로 정리하고  암기파트 외웠더니 점수가 잘나왔습니다            암기코드 초반 기본강의시부터 교수님들이 알려주시는 두문자등의 암기코드는 외우려고 노력하는게 좋습니다  나중에 해야지 하고 지나가면 나중에 외워야할 것들이 너무 많아요  미리 일정부분 하고 넘어가면 잊어버리는듯해도 나중에 복습하면 금방 복기가 되더라구요       기출문제집 활용 기출문제 풀이를    번 정도 한듯합니다  책에 바로 풀지않고 따로 연습장에 답을 체크해가며 풀고  틀린문제 표시  이후 틀린문제 위주로 일정기간후 다시 풀기로 진행을 했어요  모의고사를 많이 푸는것도 좋지만 모의고사를 이것저것 풀다보니 공부를 아예 하지 않은 문제 유형이 나오면 멘붕이 오더라구요  굳이 경험하지 않아도 될 문제들까지 풀 필요는 없을듯해서 기출문제풀이에 집중했습니다       요약강의집 활용 사실 기본서는 강의때 언급해주시는 내용외에는 공부할수가 없었어요   공부해볼려고 해도 잠이 쏟아짐     그래서 그냥 강의만 계속 들었는데  해커스 요약집이 너무 정리가 잘되어있더라구요  기본서를 몇회독씩 하면 제일 좋겠지만 힘드신분들은 기본서는 강의만 열심히 듣고 요약집 중심으로 공부하셔도 충분하실듯합니다   물론 기본서부분 기본 강의가 뒷받침되어야 요약집이 이해가 잘됩니다        노트정리 시간적 여유가 있으시고 필기하시면서 공부하시는 성향이시면 노트정리 추천드립니다  노트정리는 너무 일찍 시작하면 내용이 너무 많아서 정리가 잘 되지 않을것 같고  요약집 공부하면서 또는 요약집 한두바퀴 공부후 정리함을 추천드려요  소주제별로 중요내용만 요약해서 정리하면 복습시 효율적인 공부가 가능합니다  참고하시라고 노트 사진  장 올려봅니다   더 올리려고 했는데 에러가 나서 안되네요      공부하면서 중간중간 방황하고 좌절을 맛볼때마다  아무리 어려워도  년에 몇만명 합격생이 나오는 시험인데  그안에 내가 못들쏘냐  라는 생각으로 버텼습니다  시작할때는 거의 난독증 수준으로 책내용이 머리에 들어오지도 않았던 수준이었는데 여기까지 온걸 보면  해커스 인강의 위력은 대단한 것 같아요  나도 할 수 있다 라는 굳건한 마음가짐으로 모두 좋은 성과 거두셨으면 좋겠습니다 ,real estate agent
기술직 직원으로서 회사생활 중   회사생활에 대한 회의감과 함께  새로운 도전에 대한 열망으로 공인중개사에 도전하게 되었어요  여러 학원을 알아보았지만  인지도나  환급금액을 기준으로 해커스를 선택했습니다  결과적으로 매우 탁월한 선택이었습니다   민법의 채희대 교수님  부동산학개론의 신관식 교수님  중개사법의 황정선 교수님  부동산공시법의 홍승한 교수님  부동산공법의 한종민 교수님  부동산세법의 강성규 교수님   특히  저에게 가장 큰 도움이 되었던 강의는 공시법  세법의 최종정리 강의였습니다  불과 몇페이지 안되는 교재에 시험에 나오는 것만 쏙쏙 담아주셨습니다  정말 기가 막힙니다  시험 막판에는 이것만 죽어라 달달 외우니  남부럽지 않은  점수를 받게 되었습니다   시험 준비하시는 분들   홍승한 교수님과 강성규 교수님의 최종정리강의는 각  강 밖에 되지 않습니다  어느정도 이론 습득하시고 이 강의 또는 자료만 돌려보세요  해커스에서 합격은 그냥 떠먹여 드립니다   다시 한번 해커스 교수님들께 감사의 인사를 전합니다   정말 감사드립니다 ,real estate agent
작년에 갑자기 코로나로 시간적 여유가 생겨서 공인중개사 시험에 도전해 봤습니다  아쉽게    차 모두  문제 부족하게 불합격했지만 학교 졸업 후 오랜만에 공부하는 즐거움도 잠시나마 맛 보았습니다  직관적으로 해커스인강을 선택하게 됐는데 탁월한 선택이였던 것 같습니다  신관식 채희대 황정선 한종민 김의열 강성규 샘 좋은강의 감사드립니다  그냥 반복해서 듣다보면 개념이 잡히고 이해가 됩니다  의지가 강하고 열공하시면  년 포기하지않고 저처럼 여유있게 하셔도  년이면 누구나 합격할 수 있습니다  특별한 비법은 없고 이해 안되는 부분은 반복해서 듣다보면 자연적으로 해소됩니다  자격증취득도 좋지만 부동산 시장을 바라보는 눈과 실생활에 필요한 기본지식을 많이 습득할 수 있어서 더 좋습니다 ,real estate agent
안녕하세요 이번   회 공인중개사 동차 합격생입니다  이번 공인중개사 시험의 응시자 수가   만명을 돌파하면서  대학 수능 공무원  급시험과 더불어 많은 수험생들이 시험을 봤다고 하죠  그만큼 시험은 변별력을 구사하기 위해 난이도도 많이 높아져 가고  지문 길이도 종전의 기출문제 보다는 많이 길어졌으며  패턴들도 꽤 어렵게 많이 바뀐 것 같습니다   저는 직장인어서 학원강의보다는 인강을 선택해서 공부를 시작하게 되었습니다  시중에 공인중개사 책들을 찍어내는 출판사들도 많고 학원들도 많은데 각 합격수기를 읽으면서 해커스가 저에게는 가장 최적화된 곳이라는 생각이 들어서 선택하게 되었고  노력 끝에 합격의 영광을 누릴 수 있게 되었습니다   공부를 위한 교재를 비교했을 때 해커스만한 교재는 없었던 것 같습니다  특히  교재에 중요부분들이 하이라이트로 표시가 되어서 보기가 너무 편했고  기본서들이 이야기책처럼 쓰여져 있어서 읽는데 전혀 부담감이 없었습니다  특히 핵심요약집과 강의는 이번 시험의 대부분의 점수를 만들어 낸 것 같습니다  교수님들의 위트있는 강의로 지루함이 전혀 없었고  반복으로 듣다보면 시험장에서 저도 모르게 피식할 정도로 생각이 잘 났습니다  공부시간은 출근할 때  시간  점심때  시간  퇴근할 때  시간  밤에  시간 정도해서 평일에는  시간을 초집중해서 공부하였고  주말에는 보통    시간씩 투자를 했습니다  느즈막하게 시험준비를 시작하게 되어서 최대한 시행착오를 겪지 않으려고 많은 노력을 하였습니다   각 과목별로의 느낌은 다음과 같습니다      부동산학개론   수학을 좋아했고          등 우리 실생활에서 연관되는 내용들이 많이 나와서 재미있게 공부하였습니다  저는 계산문제를 오히려 놓치지 않고  다 풀기 위해 노력을 많이 했습니다      민법   채희대 교수님의 민법은 그냥 일품입니다  계속 귀에 꽂고 듣다 보면  책으로 따로 암기하지 않아도 시험장에서 다 생각납니다  실제   문제 해결에   분정도 소요되었고  교수님 말씀대로 민사특별법   그 중 주임법을 정말 열심히 공부했고  고득점에 도움이 많이 되었습니다      중개사법    차 과목 중 상대적으로 난이도가 낮지만  합격을 위해서는 고득점이 필요하여  열심히 해야되는 과목이라 생각듭니다  암기할 내용이 많은 것처럼 보이지만  서브노트를 작성하고  정리해 보니 양이 많지 않았습니다  시험 직전에 많은 부분들을 암기하다 보면 멘붕이 올 것 같아서 매일매일 일정량씩 외우고 또 외웠습니다      공법   한종민 교수님의 강의 스타일이 너무 좋아서 그 어렵다는 공법을 재미있게 공부할 수 있었습니다  특히 올해는 개정들도 많아서 외울거리도 너무 많았지만  교수님께서 지루하지 않게 개그를 섞어가며  가르침을 주시는데 쏙쏙 귀에 들어왔습니다      공시법 세법   공시법에서는 저는 지적법은 다 맞추는 것을 목적으로 공부를 하였고  공시법은 선택적으로 문제를 풀었습니다  특히 올해 세법이 과년도 보다 어려웠다고 하는데  해커스 강의만 주욱 따라온다면  아주 고득점은 아니어도 만족할 만한 점수가 나오는 것 같습니다   공인중개사 시험은 만점을 목표로 하는 시험이 아니고  남과 겨루는 상대평가가 아닌 절대평가인 시험입니다  그래서 공부방법은 강약을 조절해 가면서 잘 학습하면서 외우고  스스로와의 싸움이기 때문에 끊임없이 끈기를 가지고 공부하는 자세가 중요하다고 생각합니다   공부할 때는 고통스러운 부분도 많았는데   합격하고 나니 눈녹듯 사라집니다  제 스스로 열심히 한 부분도 있었지만  저 혼자만의 힘은 아니었습니다  비대면이었지만 물심양면으로 힘써주시고 도와주신 교수님들께 감사드리며  해커스의 무궁한 영광과 발전을 기원합니다 ,real estate agent
처음 덤벼들 때는 누구나 동차 합격을 목표로 시작합니다  저도 그랬습니다  누구는  개월 만에 동차 합격했네  또 누구는  개월 만에 동차 합격 했네  합격 후기를 보고 있으면 저도 금방이라도 합격할 수 있을 것만 같아 작년 여름쯤 뒤늦게 동차합격을 목표로 등록했습니다  근데 웬걸 해 본 사람은 다 압니다  혼자하기에 절대 만만한 양이 아니라는 것을 말입니다  계획에 없던 일은 수시로 생기고 계획했던 일은 종종 꼬이고 공부시간은 늘 부족했던 것 같습니다  그러다 보니 자연스레 우선  차만 합격하자로 목표를 바꿨습니다   민법은 몇 년 전에 다른 공부하면서 조금 훑어 본 적이 있어 부동산학 개론만 파고들었습니다  시간이 없어 입문과 기본 강의만  회독하고 적중예상문제 등등 하나도 풀어보지 못하고 급한 마음에 문제라고는 예상문제집 맨 뒤에 있는 모의고사  회분만 풀고 갔습니다  다행히 생각보다는 괜찮은 점수로  차를 합격했습니다   부동산학개론은 계산문제에 시간을 너무 치중할 필요는 없는 것 같습니다  지금 생각해보면 너무 고집스럽게 계산문제를 끝까지 붙들고 있었고 실제로 시험장에 가서도 계산문제를 꾸역꾸역 다 풀었는데 절대 그럴 필요가 없다는 것을 도전해보고서야 알게 되는 팁인 것 같습니다    차는 너무 준비 없이 덤벼들었고 학개론을 다시하기 싫어서라도   차는 꼭 붙어야 해서  차 준비는 올해  월 정도부터 했습니다  기본강의부터 제대로 들어보자 싶어 여러 교수님들 강의를 맛보기로 들어봤는데 저는 강의 선택 기준 첫 번째가  배속으로 돌려도 발음이 명확한 교수님 위주로 그리고 기초부터 설명을 잘 해주시는 교수님 위주로 선택했습니다   공법은 한종민 교수님  중개사실무는 황정선 교수님  공시법은 양기백 교수님  세법은 강성규 교수님 강의를 들었습니다   한종민 교수님   가끔 무표정하게 썰렁한 농담을 하시지만 예상문제 적중률이 정말 높은 것 같습니다  직접출제하신 모의고사문제와 거의 유사한 문제가 많이 나와 적잖이 놀랬습니다  단원문제와    선을 못 풀어 봐서 거기까지는 모르겠지만 전날 풀고 간 모의고사문제에서 많이 나왔던 것 같습니다   황정선 교수님   직접경험하신 실무이야기를 많이 해주셔서 저는 정말 좋았는데 그걸 컴플레인 거시는 분들이 있던데   음 저는 어디서도 들을 수 없는 개인적인 이야기를 많이 해주셔서 정말 좋았습니다   양기백 교수님   교수님 강의 듣는 자체가 설레는 시간이었던 것 같습니다  공시법을 많이 어렵게 생각할 수도 있는데 쉽게 설명해주셔서 공부시간을 많이 단축시킬 수 있었던 것 같습니다  양기백 교수님의 공시법 강의는 민법 이해에도 도움이 많이 되는 것 같습니다   강성규 교수님   세법문제가   개 뿐 이라는 게 너무 아쉬울 정도로 열강을 하십니다  교수님 덕분에 세법에 대한 기본지식을 마스터한 느낌이 듭니다  정말이지 설명을 무한 반복해 주셔서 실생활에 유용한 세법지식을 많이 습득할 수 있어 좋았습니다    차  차 합쳐서 공부한 양은 총  개월 정도가 되는 것 같습니다  타사와 비교해보고 해커스를 선택했는데 정말 잘 선택했다는 생각이 듭니다  타사는 동차합격이 아니면 환급을 안 해 주는 것으로 알고 있는데 저처럼 동차합격을 목표로 덤벼들었다가 피치 못하게 공부시간이 안 나와 따로 응시해 합격해도 해커스는 교재비까지      환급해주니 그저 감사할 따름입니다 합격만으로도 기분이 좋은데 강의료와 교재비까지 낸 것을 다시 돌려준다니 공돈이 생긴 것 같아 얼마나 기쁜지 모릅니다   올해 시험은 유난히 어려웠다는 평이 있는데 듣기 좋으라고 하는 소리가 아니라 정말이지 전문성 있는 훌륭한 교수진과 눈에 쏙쏙 들어오는 교재 덕분에 그런대로 예상보다는 점수가 잘 나와 합격할 수 있었던 것 같습니다  중개사를 바로 할 생각으로 시험을 준비한 것은 아니지만 중개사 공부가 실생활에 정말 많은 도움이 되는 것은 확실합니다  차를 잘 굴리려면 운전면허증을 따야하듯이 집을 잘 굴리려면 공인중개사 자격증을 따야 되는 것 같습니다  그리고 전적으로 해커스 도움으로  합격했다는 것을 꼭 말하고 싶습니다 ,real estate agent
